{
 "predictions_version": "1.0",
 "season": 2025,
 "week": 1,
 "model_version": "20260911-asof_v1-d333de20",
 "feature_version": "asof_v1",
 "candidate": {
  "QB": "rf",
  "RB": "rf",
  "TE": "rf",
  "WR": "rf"
 },
 "generated_at_utc": "2026-09-11T02:02:58+00:00",
 "data_through": {
  "season": 2024,
  "week": 18
 },
 "scoring": {
  "model_target": "ppr",
  "derivation": "standard = ppr - receptions_estimate; half = ppr - 0.5 * receptions_estimate (receptions_estimate = as-of L3 average receptions)",
  "interval": "validation-season residual quantiles (10th/90th) per position and candidate, added to the point prediction; floor clipped at 0"
 },
 "n": 589,
 "predictions": [
  {
   "player_id": "00-0034796",
   "name": "Lamar Jackson",
   "team": "BAL",
   "position": "QB",
   "prediction": 22.2,
   "floor": 12.3,
   "ceiling": 31.82,
   "receptions_estimate": 0.0,
   "candidate": "rf"
  },
  {
   "player_id": "00-0039910",
   "name": "Jayden Daniels",
   "team": "WAS",
   "position": "QB",
   "prediction": 21.73,
   "floor": 11.83,
   "ceiling": 31.35,
   "receptions_estimate": 0.0,
   "candidate": "rf"
  },
  {
   "player_id": "00-0034857",
   "name": "Josh Allen",
   "team": "BUF",
   "position": "QB",
   "prediction": 20.42,
   "floor": 10.52,
   "ceiling": 30.04,
   "receptions_estimate": 0.0,
   "candidate": "rf"
  },
  {
   "player_id": "00-0039150",
   "name": "Bryce Young",
   "team": "CAR",
   "position": "QB",
   "prediction": 20.03,
   "floor": 10.12,
   "ceiling": 29.65,
   "receptions_estimate": 0.0,
   "candidate": "rf"
  },
  {
   "player_id": "00-0034855",
   "name": "Baker Mayfield",
   "team": "TB",
   "position": "QB",
   "prediction": 19.62,
   "floor": 9.71,
   "ceiling": 29.24,
   "receptions_estimate": 0.0,
   "candidate": "rf"
  },
  {
   "player_id": "00-0039398",
   "name": "Joe Milton III",
   "team": "NE",
   "position": "QB",
   "prediction": 19.27,
   "floor": 9.36,
   "ceiling": 28.89,
   "receptions_estimate": 0.0,
   "candidate": "rf"
  },
  {
   "player_id": "00-0036900",
   "name": "Ja'Marr Chase",
   "team": "CIN",
   "position": "WR",
   "prediction": 18.73,
   "floor": 12.13,
   "ceiling": 26.8,
   "receptions_estimate": 8.33,
   "candidate": "rf"
  },
  {
   "player_id": "00-0039337",
   "name": "Malik Nabers",
   "team": "NYG",
   "position": "WR",
   "prediction": 18.7,
   "floor": 12.1,
   "ceiling": 26.77,
   "receptions_estimate": 6.33,
   "candidate": "rf"
  },
  {
   "player_id": "00-0039893",
   "name": "Brian Thomas Jr.",
   "team": "JAX",
   "position": "WR",
   "prediction": 18.64,
   "floor": 12.04,
   "ceiling": 26.71,
   "receptions_estimate": 7.67,
   "candidate": "rf"
  },
  {
   "player_id": "00-0035228",
   "name": "Kyler Murray",
   "team": "ARI",
   "position": "QB",
   "prediction": 18.32,
   "floor": 8.42,
   "ceiling": 27.94,
   "receptions_estimate": 0.0,
   "candidate": "rf"
  },
  {
   "player_id": "00-0039164",
   "name": "Anthony Richardson",
   "team": "IND",
   "position": "QB",
   "prediction": 18.28,
   "floor": 8.38,
   "ceiling": 27.9,
   "receptions_estimate": 0.33,
   "candidate": "rf"
  },
  {
   "player_id": "00-0039732",
   "name": "Bo Nix",
   "team": "DEN",
   "position": "QB",
   "prediction": 18.07,
   "floor": 8.16,
   "ceiling": 27.69,
   "receptions_estimate": 0.0,
   "candidate": "rf"
  },
  {
   "player_id": "00-0036355",
   "name": "Justin Herbert",
   "team": "LAC",
   "position": "QB",
   "prediction": 17.46,
   "floor": 7.55,
   "ceiling": 27.08,
   "receptions_estimate": 0.0,
   "candidate": "rf"
  },
  {
   "player_id": "00-0036322",
   "name": "Justin Jefferson",
   "team": "MIN",
   "position": "WR",
   "prediction": 17.4,
   "floor": 10.8,
   "ceiling": 25.47,
   "receptions_estimate": 7.0,
   "candidate": "rf"
  },
  {
   "player_id": "00-0037238",
   "name": "Drake London",
   "team": "ATL",
   "position": "WR",
   "prediction": 17.36,
   "floor": 10.77,
   "ceiling": 25.44,
   "receptions_estimate": 7.33,
   "candidate": "rf"
  },
  {
   "player_id": "00-0035993",
   "name": "Tyler Huntley",
   "team": "MIA",
   "position": "QB",
   "prediction": 16.93,
   "floor": 7.03,
   "ceiling": 26.55,
   "receptions_estimate": 0.0,
   "candidate": "rf"
  },
  {
   "player_id": "00-0036389",
   "name": "Jalen Hurts",
   "team": "PHI",
   "position": "QB",
   "prediction": 16.92,
   "floor": 7.01,
   "ceiling": 26.54,
   "receptions_estimate": 0.0,
   "candidate": "rf"
  },
  {
   "player_id": "00-0031381",
   "name": "Davante Adams",
   "team": "NYJ",
   "position": "WR",
   "prediction": 16.83,
   "floor": 10.23,
   "ceiling": 24.9,
   "receptions_estimate": 6.0,
   "candidate": "rf"
  },
  {
   "player_id": "00-0036212",
   "name": "Tua Tagovailoa",
   "team": "MIA",
   "position": "QB",
   "prediction": 16.77,
   "floor": 6.86,
   "ceiling": 26.39,
   "receptions_estimate": 0.0,
   "candidate": "rf"
  },
  {
   "player_id": "00-0039139",
   "name": "Jahmyr Gibbs",
   "team": "DET",
   "position": "RB",
   "prediction": 16.68,
   "floor": 10.05,
   "ceiling": 24.25,
   "receptions_estimate": 4.33,
   "candidate": "rf"
  },
  {
   "player_id": "00-0034869",
   "name": "Sam Darnold",
   "team": "MIN",
   "position": "QB",
   "prediction": 16.65,
   "floor": 6.74,
   "ceiling": 26.27,
   "receptions_estimate": 0.0,
   "candidate": "rf"
  },
  {
   "player_id": "00-0033873",
   "name": "Patrick Mahomes",
   "team": "KC",
   "position": "QB",
   "prediction": 16.56,
   "floor": 6.66,
   "ceiling": 26.18,
   "receptions_estimate": 0.0,
   "candidate": "rf"
  },
  {
   "player_id": "00-0033106",
   "name": "Jared Goff",
   "team": "DET",
   "position": "QB",
   "prediction": 16.53,
   "floor": 6.62,
   "ceiling": 26.15,
   "receptions_estimate": 0.0,
   "candidate": "rf"
  },
  {
   "player_id": "00-0035710",
   "name": "Daniel Jones",
   "team": "NYG",
   "position": "QB",
   "prediction": 16.48,
   "floor": 6.57,
   "ceiling": 26.1,
   "receptions_estimate": 0.0,
   "candidate": "rf"
  },
  {
   "player_id": "00-0031503",
   "name": "Jameis Winston",
   "team": "CLE",
   "position": "QB",
   "prediction": 16.45,
   "floor": 6.55,
   "ceiling": 26.07,
   "receptions_estimate": 0.0,
   "candidate": "rf"
  },
  {
   "player_id": "00-0031280",
   "name": "Derek Carr",
   "team": "NO",
   "position": "QB",
   "prediction": 16.33,
   "floor": 6.42,
   "ceiling": 25.95,
   "receptions_estimate": 0.0,
   "candidate": "rf"
  },
  {
   "player_id": "00-0039918",
   "name": "Caleb Williams",
   "team": "CHI",
   "position": "QB",
   "prediction": 16.28,
   "floor": 6.38,
   "ceiling": 25.9,
   "receptions_estimate": 0.0,
   "candidate": "rf"
  },
  {
   "player_id": "00-0033662",
   "name": "Cooper Rush",
   "team": "DAL",
   "position": "QB",
   "prediction": 16.21,
   "floor": 6.3,
   "ceiling": 25.83,
   "receptions_estimate": 0.0,
   "candidate": "rf"
  },
  {
   "player_id": "00-0029263",
   "name": "Russell Wilson",
   "team": "PIT",
   "position": "QB",
   "prediction": 16.16,
   "floor": 6.25,
   "ceiling": 25.78,
   "receptions_estimate": 0.0,
   "candidate": "rf"
  },
  {
   "player_id": "00-0036442",
   "name": "Joe Burrow",
   "team": "CIN",
   "position": "QB",
   "prediction": 16.15,
   "floor": 6.25,
   "ceiling": 25.77,
   "receptions_estimate": 0.0,
   "candidate": "rf"
  },
  {
   "player_id": "00-0038542",
   "name": "Bijan Robinson",
   "team": "ATL",
   "position": "RB",
   "prediction": 15.99,
   "floor": 9.36,
   "ceiling": 23.56,
   "receptions_estimate": 2.33,
   "candidate": "rf"
  },
  {
   "player_id": "00-0039075",
   "name": "Puka Nacua",
   "team": "LA",
   "position": "WR",
   "prediction": 15.94,
   "floor": 9.35,
   "ceiling": 24.02,
   "receptions_estimate": 8.33,
   "candidate": "rf"
  },
  {
   "player_id": "00-0035704",
   "name": "Drew Lock",
   "team": "NYG",
   "position": "QB",
   "prediction": 15.87,
   "floor": 5.96,
   "ceiling": 25.49,
   "receptions_estimate": 0.0,
   "candidate": "rf"
  },
  {
   "player_id": "00-0036972",
   "name": "Mac Jones",
   "team": "JAX",
   "position": "QB",
   "prediction": 15.66,
   "floor": 5.76,
   "ceiling": 25.28,
   "receptions_estimate": 0.0,
   "candidate": "rf"
  },
  {
   "player_id": "00-0036358",
   "name": "CeeDee Lamb",
   "team": "DAL",
   "position": "WR",
   "prediction": 15.55,
   "floor": 8.95,
   "ceiling": 23.62,
   "receptions_estimate": 7.33,
   "candidate": "rf"
  },
  {
   "player_id": "00-0036223",
   "name": "Jonathan Taylor",
   "team": "IND",
   "position": "RB",
   "prediction": 15.52,
   "floor": 8.89,
   "ceiling": 23.09,
   "receptions_estimate": 1.0,
   "candidate": "rf"
  },
  {
   "player_id": "00-0036407",
   "name": "Jerry Jeudy",
   "team": "CLE",
   "position": "WR",
   "prediction": 15.52,
   "floor": 8.92,
   "ceiling": 23.59,
   "receptions_estimate": 6.67,
   "candidate": "rf"
  },
  {
   "player_id": "00-0038579",
   "name": "Aidan O'Connell",
   "team": "LV",
   "position": "QB",
   "prediction": 15.49,
   "floor": 5.58,
   "ceiling": 25.1,
   "receptions_estimate": 0.0,
   "candidate": "rf"
  },
  {
   "player_id": "00-0037834",
   "name": "Brock Purdy",
   "team": "SF",
   "position": "QB",
   "prediction": 15.39,
   "floor": 5.49,
   "ceiling": 25.01,
   "receptions_estimate": 0.0,
   "candidate": "rf"
  },
  {
   "player_id": "00-0036912",
   "name": "DeVonta Smith",
   "team": "PHI",
   "position": "WR",
   "prediction": 15.38,
   "floor": 8.78,
   "ceiling": 23.45,
   "receptions_estimate": 7.67,
   "candidate": "rf"
  },
  {
   "player_id": "00-0036410",
   "name": "Tee Higgins",
   "team": "CIN",
   "position": "WR",
   "prediction": 15.17,
   "floor": 8.58,
   "ceiling": 23.25,
   "receptions_estimate": 7.67,
   "candidate": "rf"
  },
  {
   "player_id": "00-0032764",
   "name": "Derrick Henry",
   "team": "BAL",
   "position": "RB",
   "prediction": 15.06,
   "floor": 8.43,
   "ceiling": 22.63,
   "receptions_estimate": 2.0,
   "candidate": "rf"
  },
  {
   "player_id": "00-0023459",